,Genus,species,average_abundance,cumalative_abundance
21,Bacteroides,Bacteroides sp 3 1 40ABacteroides cellulosilyticusBacteroides xylanisolvensBacteroides uniformisBacteroides plebeiusBacteroides eggerthiiBacteroides fragilisBacteroides salyersiaeBacteroides caccaeBacteroides coprophilusBacteroides barnesiaeBacteroides sp 2 1 16Bacteroides sp 3 2 5Bacteroides clarusBacteroides oleiciplenusBacteroides massiliensisBacteroides intestinalisBacteroides sp 2 1 22Bacteroides sp 1 1 30Bacteroides sp 4 3 47FAABacteroides sp 9 1 42FAABacteroides stercorisBacteroides sp 1 1 6Bacteroides ovatusBacteroides sp 3 1 19Bacteroides nordiiBacteroides sp 2 2 4Bacteroides finegoldiiBacteroides faecisBacteroides doreiBacteroides fluxusBacteroides thetaiotaomicronBacteroides vulgatusBacteroides pectinophilusBacteroides salanitronisBacteroides coprocolaBacteroides sp 3 1 33FAA,0.285075128051851,0.285075128051851
136,Prevotella,Prevotella salivaePrevotella multiformisPrevotella histicolaPrevotella buccaePrevotella biviaPrevotella intermediaPrevotella disiensPrevotella pallensPrevotella melaninogenicaPrevotella amniiPrevotella multisaccharivoraxPrevotella veroralisPrevotella timonensisPrevotella oulorumPrevotella denticolaPrevotella copriPrevotella buccalisPrevotella orisPrevotella dentalisPrevotella nanceiensisPrevotella sp oral taxon 473Prevotella pleuritidisPrevotella baroniaePrevotella stercoreaPrevotella nigrescensPrevotella oralis,0.07687735388256829,0.36195248193441926
78,Eubacterium,Eubacterium halliiEubacterium siraeumEubacterium brachyEubacterium rectaleEubacterium ventriosumEubacterium infirmumEubacterium sp 3 1 31Eubacterium ramulusEubacterium saphenumEubacterium dolichumEubacterium limosumEubacterium cylindroidesEubacterium biformeEubacterium eligens,0.07572036003776964,0.4376728419721889
150,Ruminococcus,Ruminococcus bromiiRuminococcus champanellensisRuminococcus obeumRuminococcus gnavusRuminococcus flavefaciensRuminococcus callidusRuminococcus torquesRuminococcus sp 5 1 39BFAARuminococcus sp JC304Ruminococcus lactarisRuminococcus albus,0.05856635949041353,0.4962392014626025
80,Faecalibacterium,Faecalibacterium prausnitzii,0.05601654980258149,0.552255751265184
24,Bifidobacterium,Bifidobacterium pseudolongumBifidobacterium pseudocatenulatumBifidobacterium animalisBifidobacterium catenulatumBifidobacterium dentiumBifidobacterium bifidumBifidobacterium longumBifidobacterium breveBifidobacterium adolescentisBifidobacterium angulatum,0.0469463714004152,0.5992021226655992
162,Subdoligranulum,Subdoligranulum unclassifiedSubdoligranulum sp 4 3 54A2FAASubdoligranulum variabile,0.04571218321108751,0.6449143058766867
124,Parabacteroides,Parabacteroides unclassifiedParabacteroides sp 20 3Parabacteroides merdaeParabacteroides sp D13Parabacteroides goldsteiniiParabacteroides johnsoniiParabacteroides distasonis,0.040392169608701435,0.6853064754853881
147,Roseburia,Roseburia hominisRoseburia intestinalisRoseburia unclassifiedRoseburia inulinivorans,0.0331419520965036,0.7184484275818918
9,Alistipes,Alistipes putredinisAlistipes unclassifiedAlistipes indistinctusAlistipes onderdonkiiAlistipes sp AP11Alistipes senegalensisAlistipes finegoldiiAlistipes shahii,0.028738894528868388,0.7471873221107601
77,Escherichia,Escherichia unclassifiedEscherichia coliEscherichia hermannii,0.022810940983555416,0.7699982630943155
161,Streptococcus,Streptococcus gordoniiStreptococcus australisStreptococcus parasanguinisStreptococcus tigurinusStreptococcus sp BS35bStreptococcus sp GMD5SStreptococcus gallolyticusStreptococcus infantisStreptococcus lutetiensisStreptococcus infantariusStreptococcus salivariusStreptococcus constellatusStreptococcus cristatusStreptococcus dysgalactiaeStreptococcus macedonicusStreptococcus perorisStreptococcus downeiStreptococcus mitis oralis pneumoniaeStreptococcus mutansStreptococcus thermophilusStreptococcus pseudopneumoniaeStreptococcus agalactiaeStreptococcus vestibularisStreptococcus anginosusStreptococcus intermediusStreptococcus sobrinusStreptococcus pasteurianusStreptococcus oligofermentansStreptococcus sanguinis,0.021981049187006114,0.7919793122813217
106,Megamonas,Megamonas unclassifiedMegamonas hypermegaleMegamonas funiformisMegamonas rupellensis,0.02151437945727268,0.8134936917385943
51,Clostridium,Clostridium bifermentansClostridium sordelliiClostridium clostridioformeClostridium difficileClostridium innocuumClostridium ramosumClostridium perfringensClostridium butyricumClostridium sp SY8519Clostridium sp D5Clostridium asparagiformeClostridium hathewayiClostridium celatumClostridium nexileClostridium bartlettiiClostridium citroniaeClostridium bolteaeClostridium sp KLE 1755Clostridium glycolicumClostridium hiranonisClostridium sp ATCC BAA 442Clostridium spiroformeClostridium methylpentosumClostridium sp L2 50Clostridium scindensClostridium hylemonaeClostridium leptumClostridium symbiosum,0.018344216314540814,0.8318379080531352
133,Phascolarctobacterium,Phascolarctobacterium succinatutens,0.012770448843600016,0.8446083568967352
173,Veillonella,Veillonella sp 6 1 27Veillonella rattiVeillonella parvulaVeillonella atypicaVeillonella unclassifiedVeillonella dispar,0.011178861126146298,0.8557872180228815
97,Klebsiella,Klebsiella variicolaKlebsiella oxytocaKlebsiella unclassifiedKlebsiella sp MS 92 3Klebsiella pneumoniae,0.009830549022889053,0.8656177670457705
164,Sutterella,Sutterella wadsworthensisSutterella parvirubra,0.008946942650300807,0.8745647096960714
64,Dialister,Dialister succinatiphilusDialister invisusDialister micraerophilus,0.008872370963058956,0.8834370806591303
91,Haemophilus,Haemophilus haemolyticusHaemophilus sputorumHaemophilus parahaemolyticusHaemophilus paraphrohaemolyticusHaemophilus parainfluenzaeHaemophilus pittmaniaeHaemophilus influenzae,0.008677163028404372,0.8921142436875347
85,Fusobacterium,Fusobacterium periodonticumFusobacterium ulceransFusobacterium variumFusobacterium nucleatumFusobacterium necrophorumFusobacterium mortiferumFusobacterium gonidiaformans,0.008354614504002239,0.9004688581915369
66,Dorea,Dorea longicatenaDorea formicigeneransDorea unclassified,0.008109246751777977,0.9085781049433148
99,Lachnospiraceae,Lachnospiraceae bacterium 6 1 63FAALachnospiraceae bacterium 2 1 46FAALachnospiraceae bacterium 5 1 57FAALachnospiraceae bacterium ICM7Lachnospiraceae bacterium 5 1 63FAALachnospiraceae bacterium 8 1 57FAALachnospiraceae bacterium oral taxon 082Lachnospiraceae bacterium 2 1 58FAALachnospiraceae bacterium 4 1 37FAALachnospiraceae bacterium 3 1 46FAALachnospiraceae bacterium 9 1 43BFAALachnospiraceae bacterium 7 1 58FAALachnospiraceae bacterium 1 4 56FAALachnospiraceae oral taxon 107Lachnospiraceae bacterium 1 1 57FAALachnospiraceae bacterium 3 1 57FAA CT1,0.007995556753901917,0.9165736616972168
52,Collinsella,Collinsella tanakaeiCollinsella stercorisCollinsella aerofaciensCollinsella intestinalisCollinsella unclassified,0.007432832300818648,0.9240064939980355
23,Barnesiella,Barnesiella intestinihominis,0.007024702117996513,0.931031196116032
1,Acidaminococcus,Acidaminococcus fermentansAcidaminococcus sp BV3L6Acidaminococcus intestiniAcidaminococcus sp D21Acidaminococcus unclassified,0.0064000142928036016,0.9374312104088356
121,Oscillibacter,Oscillibacter unclassifiedOscillibacter sp KLE 1728Oscillibacter sp KLE 1745,0.006353823589603382,0.9437850339984389
8,Akkermansia,Akkermansia muciniphila,0.006150019566360641,0.9499350535647996
